item,group,status,beforeItems,afterItems,obsolete,imprimatur
toile de lin toilette,[Toiles de lin et de chanvre],ambiguous,[Toile ; de lin ; toilette] [Toiles ; de lin ; toilette],[Toile ; de lin ; toilette] [Toiles ; de lin ; toilette],no,
toile de lin lingerie,[Toiles de lin et de chanvre],ambiguous,[Toile ; de lin ; lingerie],[Toile ; de lin ; lingerie],no,
toile de lin et de chanvre,[Toiles de lin et de chanvre],ambiguous,[///Objets manufacturés///Toiles de lin et de chanvre] [Toiles diverses de lin et de chanvre] [Toiles mêlées ; de lin et de chanvre] [Toiles mélées de lin et de chanvre] [Toiles mêlées de lin et de chanvre],[///Objets manufacturés///Toiles de lin et de chanvre] [Toiles diverses de lin et de chanvre] [Toiles mêlées ; de lin et de chanvre] [Toiles mélées de lin et de chanvre] [Toiles mêlées de lin et de chanvre],no,
toile de lin de Valenciennes,[Toiles de lin et de chanvre],ambiguous,[Toile ; de lin ; de valenciennes] [Toile ; de lin ; de Valenciennes] [Toile ; De Lin ; De valenciennes] [Toile ; de lin ; de Valencienness] [Toile ; de lin ; Valenciennes],[Toile ; de lin ; de valenciennes] [Toile ; de lin ; de Valenciennes] [Toile ; De Lin ; De valenciennes] [Toile ; de lin ; de Valencienness] [Toile ; de lin ; Valenciennes],no,
toile de lin de Saint-Quentin,[Toiles de lin et de chanvre],ambiguous,[Toile ; de lin ; de s.queatin] [Toile ; de lin ; de s.Quentin] [Toile ; de lin ; de S.Quentin] [Toile ; de lin ; de Saint Quentin] [Toile ; de lin ; de Saint-Quentin] [Toile ; de lin ; de St Quentin] [Toile ; de lin ; de St. Quentin] [Toile ; de lin ; des quentin] [Toile ; de Lin ; Des Quentin] [Toile ; de lin de ; Saint Quentin] [Toile ; de lin de Saint Quentin] [Toile ; de lin de St Quentin] [Toile de lin ; de Saint Quentin] [Toile de lin de Saint Quantin] [Toile de lin de Saint Quentin] [Toile; de lin; de St. Quentin] [Toiles ; de lin ; de Saint-Quentin] [Toille ; de lin ; de Saint Quentin] [Toille de lin de Saint Quentin] [Toile ; de lin ; Saint Quentin] [Toile ; de Saint Quentin] [Toile ; de St Quentin] [Toile de Saint Quentin] [Toiles ; de Saint Quentin] [Toille ; de Saint Quentin],[Toile ; de lin ; de s.queatin] [Toile ; de lin ; de s.Quentin] [Toile ; de lin ; de S.Quentin] [Toile ; de lin ; de Saint Quentin] [Toile ; de lin ; de Saint-Quentin] [Toile ; de lin ; de St Quentin] [Toile ; de lin ; de St. Quentin] [Toile ; de lin ; des quentin] [Toile ; de Lin ; Des Quentin] [Toile ; de lin de ; Saint Quentin] [Toile ; de lin de Saint Quentin] [Toile ; de lin de St Quentin] [Toile de lin ; de Saint Quentin] [Toile de lin de Saint Quantin] [Toile de lin de Saint Quentin] [Toile; de lin; de St. Quentin] [Toiles ; de lin ; de Saint-Quentin] [Toille ; de lin ; de Saint Quentin] [Toille de lin de Saint Quentin] [Toile ; de lin ; Saint Quentin] [Toile ; de Saint Quentin] [Toile ; de St Quentin] [Toile de Saint Quentin] [Toiles ; de Saint Quentin] [Toille ; de Saint Quentin] [Toiles ; de lin ; de Saint Quentin],no,
toile de lin blanche,[Toiles de lin et de chanvre],ambiguous,"[Toile ; de lin ; blanch] [Toile ; de lin ; blanche] [Toile ; de lin ; Blanche] [Toile ; de lin ; blanche ;] [Toile ; De lin ; Blanches] [Toile ; de lin blanche] [Toile ; de lin Blanches] [Toile de lin ; blanche] [toile de lin blanche] [Toile de lin blanche] [Toile de lin, blanche] [Toiles ; de lin ; blanche] [Toiles ; de lin blanche] [Toiles de lin blanche] [Toiles de lin, blanches] [Toille ; de lin ; blanche] [Toille de lin blanche] [Toile ; de lin ; blanche ; commune] [Toile de lin blanche commune] [Toiles diverses ; de lin blanche]","[Toile ; de lin ; blanch] [Toile ; de lin ; blanche] [Toile ; de lin ; Blanche] [Toile ; de lin ; blanche ;] [Toile ; De lin ; Blanches] [Toile ; de lin blanche] [Toile ; de lin Blanches] [Toile de lin ; blanche] [toile de lin blanche] [Toile de lin blanche] [Toile de lin, blanche] [Toiles ; de lin ; blanche] [Toiles ; de lin blanche] [Toiles de lin blanche] [Toiles de lin, blanches] [Toille ; de lin ; blanche] [Toille de lin blanche] [Toile ; de lin ; blanche ; commune] [Toile de lin blanche commune] [Toiles diverses ; de lin blanche]",no,
toile de lin,[Toiles de lin et de chanvre],ambiguous,"[Toile ; de lin] [Toile ; De lin] [Toile de lin] [Toile de Lin] [Toiles ; de lin] [Toiles de lin] [Toiles de Lin] [Toille ; de lin] [Toille ; de Lin] [Toille de lain] [Toille de lin] [Toille de Lin] [Toilles de lin] [Toillle de lin] [Toile ; de lin ; commune] [Toile de lin commune] [Toiles ; de lin ; commune] [Toiles ; de lin commune] [Toile ; de lin ; divers] [Toile ; de lin ; diverse] [Toile ; de lin ; diverses] [Toile ; De Lin ; Diverses] [Toile ; de lin diverse] [Toile de lin ; divers] [Toile de lin diverse] [Toile; de lin; diverses] [Toiles ; de lin ; divers] [Toiles ; de lin ; diverses] [Toiles ; De lin ; Diverses] [Toiles ; de lin diverses] [Toiles ; De pin ; Diverses] [Toiles de lin ; diverses] [Toiles de lin diverse] [Toiles de Lin diverse] [Toiles de lin diverses] [Toiles de lin, diverses] [Toille ; de lin ; diverse] [Toille en lin] [Toilerie ; toiles de lin] [Toilerie ; Toiles de lin] [Toilerie ; toiles de lin de toutes sortes] [Toilerie ; toiles delin de toutes sortes]","[Toile ; de lin] [Toile ; De lin] [Toile de lin] [Toile de Lin] [Toiles ; de lin] [Toiles de lin] [Toiles de Lin] [Toille ; de lin] [Toille ; de Lin] [Toille de lain] [Toille de lin] [Toille de Lin] [Toilles de lin] [Toillle de lin] [Toile ; de lin ; commune] [Toile de lin commune] [Toiles ; de lin ; commune] [Toiles ; de lin commune] [Toile ; de lin ; divers] [Toile ; de lin ; diverse] [Toile ; de lin ; diverses] [Toile ; De Lin ; Diverses] [Toile ; de lin diverse] [Toile de lin ; divers] [Toile de lin diverse] [Toile; de lin; diverses] [Toiles ; de lin ; divers] [Toiles ; de lin ; diverses] [Toiles ; De lin ; Diverses] [Toiles ; de lin diverses] [Toiles ; De pin ; Diverses] [Toiles de lin ; diverses] [Toiles de lin diverse] [Toiles de Lin diverse] [Toiles de lin diverses] [Toiles de lin, diverses] [Toille ; de lin ; diverse] [Toille en lin] [Toilerie ; toiles de lin] [Toilerie ; Toiles de lin] [Toilerie ; toiles de lin de toutes sortes] [Toilerie ; toiles delin de toutes sortes]",no,
toile de chanvre fine,[Toiles de lin et de chanvre],ambiguous,[Toile ; de chanvre ; fine],[Toile ; de chanvre ; fine],no,
toile de chanvre et de lin,[Toiles de lin et de chanvre],ambiguous,[///Objets manufacturés///Toiles de lin et chanvre] [///Objets manufacturés///Toiles diverses de lin et de chanvre] [///Objets manufacturés///Toiles diverses en lin et chanvre] [Toiles en lin et de chanvre] [Toiles ; mêlées de chanvre et de lin] [Toilerie ; toiles de lin et de chanvre] [Toilerie ; toiles mélées de lin et de chanvre] [Toilerie ; Toiles mélées de lin et de chanvre],[Toiles de lin et de chanvre] [Toiles de lin et de chanvre mêlée] [///Objets manufacturés///Toiles de lin et chanvre] [///Objets manufacturés///Toiles diverses de lin et de chanvre] [///Objets manufacturés///Toiles diverses en lin et chanvre] [Toiles en lin et de chanvre] [Toiles ; mêlées de chanvre et de lin] [Toilerie ; toiles de lin et de chanvre] [Toilerie ; toiles mélées de lin et de chanvre] [Toilerie ; Toiles mélées de lin et de chanvre],no,
toile de chanvre d'emballage,[Toiles de lin et de chanvre],ambiguous,[Toile de chanvre d'emballage] [Toiles ; de chanvre ; d'emballage] [Toiles de chanvre d'emballage],[Toile de chanvre d'emballage] [Toiles ; de chanvre ; d'emballage] [Toiles de chanvre d'emballage],no,
toile de chanvre blanche,[Toiles de lin et de chanvre],ambiguous,[Toile ; chanvre ; blanche] [Toile ; de chanvre ; blanche] [Toile de chanvre blanche] [Toiles ; de chanvre ; blanche] [Toiles de chanvre blanche] [Toille ; de chanvre ; blanche],[Toile ; chanvre ; blanche] [Toile ; de chanvre ; blanche] [Toile de chanvre blanche] [Toiles ; de chanvre ; blanche] [Toiles de chanvre blanche] [Toille ; de chanvre ; blanche],no,
toile de chanvre ???,[Toiles de lin et de chanvre],ambiguous,[Toile ; de chanvre ; ...],[Toile ; de chanvre ; ...],no,
toile de chanvre,[Toiles de lin et de chanvre],ambiguous,[Toile ; de chanvre] [Toile ; de Chanvre] [Toile ; De chanvre] [Toile de chanure] [toile de chanvre] [Toile de chanvre] [Toile de Chanvre] [Toile; de chanvre] [Toile; de Chanvre] [Toiles ; de chanvre] [Toiles ; de Chanvre] [Toiles de chanvre] [Toiles de Chanvre] [Toiles de Chanvres] [Toille ; de chanvre] [Toille ; de Chanvre] [Toille de chanure] [Toille de chanvre] [Toille de Chanvre] [TOILLE de Chanvre] [Toille de charures] [Toile ; de chanvre ; diverse] [Toiles ; de chanvre ; diverses] [Toiles ; de Chanvre ; diverses] [Toiles ; De chanvre ; Diverses] [Toiles ; de chanvre diverse] [Toiles ; de chanvre diverses] [Toiles de chanvre ; diverses] [Toiles de chanvre diverses] [Toille ; de chanvre ; diverse] [Toilles ; de chanvre ; diverses] [Toile de fil de chanvre] [Toiles diverses de chanvre] [Toilerie ; toiles de chanvre] [Toilerie ; Toiles de chanvre],[Toile ; de chanvre] [Toile ; de Chanvre] [Toile ; De chanvre] [Toile de chanure] [toile de chanvre] [Toile de chanvre] [Toile de Chanvre] [Toile; de chanvre] [Toile; de Chanvre] [Toiles ; de chanvre] [Toiles ; de Chanvre] [Toiles de chanvre] [Toiles de Chanvre] [Toiles de Chanvres] [Toille ; de chanvre] [Toille ; de Chanvre] [Toille de chanure] [Toille de chanvre] [Toille de Chanvre] [TOILLE de Chanvre] [Toille de charures] [Toile ; de chanvre ; diverse] [Toiles ; de chanvre ; diverses] [Toiles ; de Chanvre ; diverses] [Toiles ; De chanvre ; Diverses] [Toiles ; de chanvre diverse] [Toiles ; de chanvre diverses] [Toiles de chanvre ; diverses] [Toiles de chanvre diverses] [Toille ; de chanvre ; diverse] [Toilles ; de chanvre ; diverses] [Toile de fil de chanvre] [Toiles diverses de chanvre] [Toilerie ; toiles de chanvre] [Toilerie ; Toiles de chanvre],no,
toile de Cambrai et de lin,[Toiles de lin et de chanvre],ambiguous,[Toile ; de lin ; de cambray] [Toile ; de lin ; de Cambray],[Toile ; de lin ; de cambray] [Toile ; de lin ; de Cambray],no,
toile de lin pour emballage,[Toiles de lin et de chanvre],ambiguous,[Toille de lin pour embalages],[Toille de lin pour embalages],no,
toile de lin d'Anvers,[Toiles de lin et de chanvre],ambiguous,[Toille de lin ditte d'anvers],[Toille de lin ditte d'anvers],no,
toile de chanvre de Halle,[Toiles de lin et de chanvre],ambiguous,[Toille de chanvre ville de Halle] [Toille de chanvre ditte de halle],[Toille de chanvre ville de Halle] [Toille de chanvre ditte de halle],no,
toile écrue de lin,[Toiles de lin et de chanvre],ambiguous,,[Toile ; de lin ; écrue] [Toile ; de lin ; lerue] [Toile de lin ecrue] [Toile de lin écrue] [Toile de lin écrus] [Toiles ; de lin ; écrue] [Toille de lin ecrue],no,
toile fine de lin,[Toiles de lin et de chanvre],ambiguous,,[Toile ; de lin ; fin] [Toile ; de lin ; fine] [Toile de lin fine] [Toiles ; de lin fine] [Toille ; de lin ; fine] [Toilles ; de lin ; fines] [Toile ; fine ; de lin] [Toile; fine de lin] [Toille ; fine ; de lin],no,
toile de chanvre à voile,[Toiles de lin et de chanvre],ambiguous,,[Toile ; de chanvre ; à voile] [Toile de chanvre à voile] [Toile de chanvre à voiles] [Toiles ; De chanvre ; A voile] [Toiles ; de chanvre ; à voile] [Toiles ; De chanvre ; Avoile] [Toiles ; de chanvre à voile] [Toiles de chanvre à voile],no,
toile de chanvre grosse,[Toiles de lin et de chanvre],ambiguous,,[Toiles ; de chanvre ; grosse],no,
toile de chanvre d'étoupes,[Toiles de lin et de chanvre],ambiguous,,[Toile ; étoupe ; de chanvre] [Toile etoupe de chanvre] [Toile de chanvre d'étoupe] [Toile ; d'etoupe ; de chanvre] [Toile ; d'Etoupe ; de chanvre] [Toile ; d'étoupe ; de chanvre] [Toile ; d'étoupes ; de chanvre] [Toile d'étoupe de chanvre] [Toile; d'étoupe; de chanvre] [Toiles ; d'étoupes ; de chanvre] [Toille d'etoupe de chanvre] [Toilles des toupes de chanvre] [toile d'etouppes et de chanvre],no,
toile de chanvre coutil,[Toiles de lin et de chanvre],ambiguous,,[Toile ; de chanvre ; loutil] [Toile de chanvre coutil],no,
toile de Cambrai et de lin fin,[Toiles de lin et de chanvre],ambiguous,,[Toile ; de lin ; fine de fambrai],no,
toile étroite de lin,[Toiles de lin et de chanvre],ambiguous,,[Toiles de lin étroite] [Toille de lin etroite] [Toille de lin étroite],no,
toile de lin royale,[Toiles de lin et de chanvre],ambiguous,[Toile ; de lin ; Royale] [Toile ; de Lin ; Royale] [Toile de lin ; Royalle],[Toile ; royale de lin] [Toille royale de lin] [Toile; royale lin] [Toile ; de lin ; Royale] [Toile ; de Lin ; Royale] [Toile de lin ; Royalle],no,
étoffe de coton éternelle,[Coton de toute espèce],ambiguous,[Etoffes ; de coton ; eternelle],[Etoffes ; de coton ; eternelle],no,
étoffe de coton et de laine,[Coton de toute espèce],ambiguous,[Etoffes ; de coton et de laine ; diverses] [Etoffes ; de coton et laine] [etoffes de cotton et laine] [Etoffe ; de laine et coton] [///Objets manufacturés///Etoffes en coton et en laine],[Etoffes ; de coton et laine] [etoffes de cotton et laine] [Etoffe ; de laine et coton] [///Objets manufacturés///Etoffes en coton et en laine],no,
étoffe de coton et de fil,[Coton de toute espèce],ambiguous,[Etoffe coton et fil] [Etoffe de cotton et fil] [Etoffes ; De coton et fil] [Etoffes ; de coton et fils ; diverses] [Etoffes ; de fil et coton] [Etoffes de fil et coton] [etoffes de fil et cotton] [Etoffe ; fil et coton] [Etoffe fil et coton] [Etoffes ; fil et coton] [Tissus de fil et coton mélangés] [Toile ; et etoffes ; de coton],[etoffes de fil et cotton / aune] [Etoffe coton et fil] [Etoffe de cotton et fil] [Etoffes ; De coton et fil] [Etoffes ; de coton et fils ; diverses] [Etoffes ; de fil et coton] [Etoffes de fil et coton] [etoffes de fil et cotton] [Etoffe ; fil et coton] [Etoffe fil et coton] [Etoffes ; fil et coton],no,
étoffe de coton et chapeaux,[Coton de toute espèce],ambiguous,[Etoffes ; de coton et chapeaux],[Etoffes ; de coton et chapeaux],no,
étoffe de coton et bonneterie,[Coton de toute espèce],ambiguous,[Etoffes ; de coton et bonneterie],[Etoffes ; de coton et bonneterie],no,
étoffe de coton en drap,[Coton de toute espèce],ambiguous,[Etoffe de coton en drap] [Etoffes ; de coton ; en drap] [Etoffes de coton (en drap)],[Etoffe de coton en drap] [Etoffes ; de coton ; en drap] [Etoffes de coton (en drap)],no,
étoffe de coton,[Coton de toute espèce],ambiguous,[Cotonades ; Etoffes] [Cotonades ; étoffes] [Cotonnade ; Etoffes] [Cotonnades ; Etoffes] [Cotonnades ; étoffes idem] [Etoffes coton;] [Etoffes coton; Velours] [Etoffe ; de coton] [Etoffe de coton] [Etoffe de Coton] [Étoffe de coton] [Etoffes ; de coton] [Etoffes ; De coton] [Etoffes de camelot] [Etoffes de coton] [Etoffe ; de coton diverses] [Etoffe de coton diverses] [Etoffes ; de coton ; diverses] [Etoffes de coton diverses] [Etoffe divers ; de coton] [Etoffes ; diverses ; de coton] [Etoffes diverses de coton] [Etoffe fil en coton] [Etoffes sur coton] [///Objets manufacturés///Etoffes de coton],[Cotonades ; Etoffes] [Cotonades ; étoffes] [Cotonnade ; Etoffes] [Cotonnades ; Etoffes] [Cotonnades ; étoffes idem] [Etoffes coton;] [Etoffes coton; Velours] [Etoffe ; de coton] [Etoffe de coton] [Etoffe de Coton] [Étoffe de coton] [Etoffes ; de coton] [Etoffes ; De coton] [Etoffes de camelot] [Etoffes de coton] [Etoffe ; de coton diverses] [Etoffe de coton diverses] [Etoffes ; de coton ; diverses] [Etoffes de coton diverses] [Etoffe divers ; de coton] [Etoffes ; diverses ; de coton] [Etoffes diverses de coton] [Etoffe fil en coton] [Etoffes sur coton] [///Objets manufacturés///Etoffes de coton],no,
velours de coton,[Coton de toute espèce],ambiguous,[Etoffes ; de coton ; en velour] [Etoffes ; de coton ; en velours] [Etoffe ; de coton ; velour] [Etoffe ; de coton ; velours] [Etoffes ; de coton ; velour] [Etoffes ; de coton ; velours] [Etoffes; De coton; velours; retour] [Velour ; de coton] [Velour de coton] [velour de cotton] [Velour; de coton] [Velours ; de coton] [Velours de coton] [Velours de cotton],[Etoffes ; de coton ; en velour] [Etoffes ; de coton ; en velours] [Etoffe ; de coton ; velour] [Etoffe ; de coton ; velours] [Etoffes ; de coton ; velour] [Etoffes ; de coton ; velours] [Etoffes; De coton; velours; retour] [Velour ; de coton] [Velour de coton] [velour de cotton] [Velour; de coton] [Velours ; de coton] [Velours de coton] [Velours de cotton],no,
tricots de coton et tricots de fil,[Coton de toute espèce],ambiguous,[Bonneterie ; fil et coton ; tricot],[Bonneterie ; fil et coton ; tricot],no,
tricots de coton,[Coton de toute espèce],ambiguous,[Bonneterie ; de coton ; au tricot] [Bonneterie ; de coton ; tricot],[Bonneterie ; de coton ; au tricot] [Bonneterie ; de coton ; tricot],no,
toile indienne de coton,[Coton de toute espèce],ambiguous,[Toille ; indienne ; de coton],[Toille ; indienne ; de coton],no,
toile de coton piquée,[Coton de toute espèce],ambiguous,[Toile ; de coton ; piquée] [toille de coton picquée],[Toile ; de coton ; piquée] [toille de coton picquée],no,
toile de coton persiste,[Coton de toute espèce],ambiguous,[Toile ; de coton ; persiste],[Toile ; de coton ; persiste],no,
toile de coton peinte,[Coton de toute espèce],ambiguous,[Toille ; coton ; peinte] [Toile ; de coton ; peinte] [toile de coton peinte] [Toile de coton peinte] [Toile de coton pinte] [Toiles ; de coton ; peinte] [Toiles de coton ; peintes] [Toiles de coton peinte] [Toiles de coton peintes] [Toille ; de coton ; peinte],[Toille ; coton ; peinte] [Toile ; de coton ; peinte] [toile de coton peinte] [Toile de coton peinte] [Toile de coton pinte] [Toiles ; de coton ; peinte] [Toiles de coton ; peintes] [Toiles de coton peinte] [Toiles de coton peintes] [Toille ; de coton ; peinte],no,
toile de coton mousselines Nankin et des Indes,[Coton de toute espèce],ambiguous,"[///Objets manufacturés///Toiles de coton, mousseline, nankin, et des Indes]","[///Objets manufacturés///Toiles de coton, mousseline, nankin, et des Indes]",no,
toile de coton mousseline,[Coton de toute espèce],ambiguous,[Toille ; coton ; mousseline] [Toile ; de coton ; en mousseline] [Toile de coton en mousseline] [Toiles de coton en mousseline] [Toile ; de coton ; mousseline] [Toiles ; de coton ; mousseline] [Toiles ; De coton ; Mousseline],[Toille ; coton ; mousseline] [Toile ; de coton ; en mousseline] [Toile de coton en mousseline] [Toiles de coton en mousseline] [Toile ; de coton ; mousseline] [Toiles ; de coton ; mousseline] [Toiles ; De coton ; Mousseline],no,
toile de coton façon de Nankin,[Coton de toute espèce],ambiguous,[Toile ; de coton ; façon ; de Nankin],[Toile ; de coton ; façon ; de Nankin],no,
toile de coton et de fil,[Coton de toute espèce],ambiguous,[///Objets manufacturés///Toile de fil et coton] [///Objets manufacturés///Toiles de fil et coton] [Toiles ; cotonade ; fil et coton] [Toile ; de fil et coton] [Toile de fil et coton] [Toiles ; de fil et coton] [Toiles de fil et coton] [Toile ; de fil et coton ; diverses] [Toiles ; De fil et coton ; Diverses] [Toiles de fil et coton diverses] [Toiles de fil et de coton] [Toiles diverses ; fil et coton] [Toile ; fil et coton] [toile ; fil et cotton] [Toile ; fil et cotton] [Toile : fil et coton] [Toile fil et coton] [Toile; fil et coton] [Toiles ; fil et coton] [Toille ; fil et coton] [Toille fil et cotton] [Toilles ; fil et coton] [Toile ; fil et coton ; diverse] [Toiles ; fil et coton ; diverses] [Toiles ; mêlées de fil et coton] [Toiles mélées de fil et coton] [Toiles mêlées de fil et coton] [Toilerie ; toiles mélées de fil et coton],[Toile de fil en coton] [Toiles de fil en coton] [///Objets manufacturés///Toile de fil et coton] [///Objets manufacturés///Toiles de fil et coton] [Toiles ; cotonade ; fil et coton] [Toile ; de fil et coton] [Toile de fil et coton] [Toiles ; de fil et coton] [Toiles de fil et coton] [Toile ; de fil et coton ; diverses] [Toiles ; De fil et coton ; Diverses] [Toiles de fil et coton diverses] [Toiles de fil et de coton] [Toiles diverses ; fil et coton] [Toile ; fil et coton] [toile ; fil et cotton] [Toile ; fil et cotton] [Toile : fil et coton] [Toile fil et coton] [Toile; fil et coton] [Toiles ; fil et coton] [Toille ; fil et coton] [Toille fil et cotton] [Toilles ; fil et coton] [Toile ; fil et coton ; diverse] [Toiles ; fil et coton ; diverses] [Toiles ; mêlées de fil et coton] [Toiles mélées de fil et coton] [Toiles mêlées de fil et coton] [Toilerie ; toiles mélées de fil et coton],no,
toile de coton bisinette,[Coton de toute espèce],ambiguous,[Toile ; de coton ; bisinette],[Toile ; de coton ; bisinette],no,
toile de coton basin,[Coton de toute espèce],ambiguous,[Toile ; de coton ; bazin] [Toiles ; de coton ; bazin] [Toiles ; De coton ; Bazin],[Toile ; de coton ; bazin] [Toiles ; de coton ; bazin] [Toiles ; De coton ; Bazin],no,
toile de coton antoine,[Coton de toute espèce],ambiguous,[Toiles ; de coton ; antoine],[Toiles ; de coton ; antoine],no,
toile de coton ???,[Coton de toute espèce],ambiguous,[Toile ; de coton ; ?] [Toile ; de coton ; ...] [Toile ; de coton ; ***] [Toile ; de coton ; F...],[Toile ; de coton ; ?] [Toile ; de coton ; ...] [Toile ; de coton ; ***] [Toile ; de coton ; F...],no,
toile de coton,[Coton de toute espèce],ambiguous,"[Cotonnades en toile et nankin] [Cotonades ; Toile de coton, étrangères diverses] [///Objets manufacturés///Toile de coton] [///Objets manufacturés///Toiles de coton] [Toile ; coton] [Toile coton] [Toiles ; coton] [Toie ; de coton] [toile ; de coton] [Toile ; de coton] [Toile ; de Coton] [Toile ; De coton] [toile ; de cotton] [Toile ; de cotton] [toile de coton] [Toile de coton] [Toile de Coton] [toile de cotton] [Toile de cotton] [Toile de Cotton] [Toile; de coton] [Toile; De coton] [Toiles ; de coton] [Toiles de coton] [Toiles de Fotton] [Toiles de halle de Languenan] [Toiles; De coton] [Toille ; de coton] [Toille ; de cotton] [Toille ; de Cotton] [toille de coton] [Toille de coton] [TOILLE de Coton] [Toille de cotton] [Toille de Cotton] [Toille Decoton] [Toilles de cotton] [Toile ; de coton ; divers] [Toile ; de coton ; diverse] [Toile ; de coton ; diverses] [Toile de coton diverses] [Toile de Coton diverses] [Toiles ; de coton ; diverses] [Toiles ; De coton ; Diverses] [Toiles ; De coton diverses] [Toiles de coton ; diverses] [Toiles de coton diverses] [Toiles de coton, diverses] [Toile de coton en fil] [Toile de coton et nankin] [Toiles de coton et nankin] [Toile ; De fil de coton] [Toiles ; De fil de coton ; Diverses] [Toiles ; De fil de coton diverses] [Toile ; fil de coton] [Toile fil en coton] [Toiles mêlées diverses ; de coton] [Toile ; tout coton]","[Cotonnades en toile et nankin] [Cotonades ; Toile de coton, étrangères diverses] [///Objets manufacturés///Toile de coton] [///Objets manufacturés///Toiles de coton] [Toile ; coton] [Toile coton] [Toiles ; coton] [Toie ; de coton] [toile ; de coton] [Toile ; de coton] [Toile ; de Coton] [Toile ; De coton] [toile ; de cotton] [Toile ; de cotton] [toile de coton] [Toile de coton] [Toile de Coton] [toile de cotton] [Toile de cotton] [Toile de Cotton] [Toile; de coton] [Toile; De coton] [Toiles ; de coton] [Toiles de coton] [Toiles de Fotton] [Toiles de halle de Languenan] [Toiles; De coton] [Toille ; de coton] [Toille ; de cotton] [Toille ; de Cotton] [toille de coton] [Toille de coton] [TOILLE de Coton] [Toille de cotton] [Toille de Cotton] [Toille Decoton] [Toilles de cotton] [Toile ; de coton ; divers] [Toile ; de coton ; diverse] [Toile ; de coton ; diverses] [Toile de coton diverses] [Toile de Coton diverses] [Toiles ; de coton ; diverses] [Toiles ; De coton ; Diverses] [Toiles ; De coton diverses] [Toiles de coton ; diverses] [Toiles de coton diverses] [Toiles de coton, diverses] [Toiles mêlées diverses ; de coton] [Toile ; tout coton]",no,
toile cotonnade,[Coton de toute espèce],ambiguous,[Toiles ; cotonade] [Toille cotonade],[Toiles ; cotonade] [Toille cotonade],no,
siamoise de coton et de fil,[Coton de toute espèce],ambiguous,[etoffes de fil et cotton dite sciamoises] [Siamoise ; fil et coton] [Siamoises fil et coton] [Toiles ; de fil ; en coton ; siamoise] [Toiles ; de fil et coton ; siamoise] [Toiles ; De fil et coton ; Siamoise] [Toiles de fil et coton ; siamoise] [Toiles de fil et coton siamoise] [toile de fil et de coton dite Sciamoise] [Toile de fil et coton en siamoise] [Toile de fil et coton ; siamoise] [Toile de fil et Coton Siamoise] [Tooile ; en siamoise ; fil et coton] [Toile ; fil et coton ; en siamoise] [Toile ; fil et coton ; siamoise] [Toiles ; fil et coton ; siamoise] [Toiles fil et coton ; siamoise] [Toile ; siamoise ; fil et coton] [Toile ; Siamoise ; fil et coton] [Toile siamoise fil et coton] [Toiles ; siamoise ; fil et coton] [Toiles ; siamoise fil et coton] [Toiles siamoise fil et coton] [Toille ; siamoise ; fil et coton] [Toille siamoise fil et coton] [Toilles ; siamoises ; fil et coton],[Toile siamoise fil en coton] [etoffes de fil et cotton dite sciamoises] [Siamoise ; fil et coton] [Siamoises fil et coton] [Toiles ; de fil ; en coton ; siamoise] [Toiles ; de fil et coton ; siamoise] [Toiles ; De fil et coton ; Siamoise] [Toiles de fil et coton ; siamoise] [Toiles de fil et coton siamoise] [toile de fil et de coton dite Sciamoise] [Toile de fil et coton en siamoise] [Toile de fil et coton ; siamoise] [Toile de fil et Coton Siamoise] [Tooile ; en siamoise ; fil et coton] [Toile ; fil et coton ; en siamoise] [Toile ; fil et coton ; siamoise] [Toiles ; fil et coton ; siamoise] [Toiles fil et coton ; siamoise] [Toile ; siamoise ; fil et coton] [Toile ; Siamoise ; fil et coton] [Toile siamoise fil et coton] [Toiles ; siamoise ; fil et coton] [Toiles ; siamoise fil et coton] [Toiles siamoise fil et coton] [Toille ; siamoise ; fil et coton] [Toille siamoise fil et coton] [Toilles ; siamoises ; fil et coton],no,
satinette de coton,[Coton de toute espèce],ambiguous,[Etoffes ; de coton ; satinette],[Etoffes ; de coton ; satinette],no,
